{
  "schema_version": "media_atlas_manifest.v0.1",
  "atlas_id": "frontend_runtime_art_atlas_v0_1",
  "created_at": "2026-07-02T00:00:00+08:00",
  "source_manifest": "game_data/media/frontend_runtime_mock/frontend_runtime_art_media_manifest.v0.1.json",
  "source_media_pack_id": "frontend_runtime_art_media_pack_v0_1",
  "media_layer": "published_media",
  "atlas_mode": "spritesheet",
  "public_url_prefix": "/assets/frontend_runtime_mock/processed",
  "items": [
    {
      "animation_id": "enemy_shadow_tide_runner.icon.static",
      "asset_id": "enemy_shadow_tide_runner",
      "source_game_id": "shadow_tide_runner",
      "asset_name": "影潮奔行者",
      "asset_type": "enemy_archetype",
      "media_role": "icon",
      "frame_source_kind": "single_frame_static",
      "loop_continuity_ref": null,
      "playback": {
        "state": "static",
        "fps": 1,
        "loop": false,
        "frame_count": 1
      },
      "spritesheet": {
        "url": "/assets/frontend_runtime_mock/atlas_sheets/enemy_shadow_tide_runner__icon__static__spritesheet.png",
        "local_path": "game_data/media/frontend_runtime_mock/atlas_sheets/enemy_shadow_tide_runner__icon__static__spritesheet.png",
        "width": 856,
        "height": 856,
        "sha256": "aeca1f6a71295d9f5bd1902da956c7513f202a46798763fc0599659b92bfeca0"
      },
      "frames": [
        {
          "frame_id": "enemy_shadow_tide_runner.icon.static.frame_000",
          "index": 0,
          "url": "/assets/frontend_runtime_mock/processed/enemy_shadow_tide_runner_icon_d25ae835.png",
          "local_path": "game_data/media/frontend_runtime_mock/processed/enemy_shadow_tide_runner_icon_d25ae835.png",
          "x": 0,
          "y": 0,
          "width": 856,
          "height": 856,
          "duration_ms": 1000,
          "sha256": "aeca1f6a71295d9f5bd1902da956c7513f202a46798763fc0599659b92bfeca0",
          "anchor": {
            "preset": "center",
            "x": 0.5,
            "y": 0.5
          }
        }
      ]
    },
    {
      "animation_id": "enemy_shadow_tide_runner.unit_sprite.idle",
      "asset_id": "enemy_shadow_tide_runner",
      "source_game_id": "shadow_tide_runner",
      "asset_name": "影潮奔行者",
      "asset_type": "enemy_archetype",
      "media_role": "unit_sprite",
      "frame_source_kind": "deterministic_frame_sequence",
      "loop_continuity_ref": "examples/review_packs/frontend_runtime_loop_continuity_report.v0.1.json#enemy_shadow_tide_runner.unit_sprite.idle",
      "playback": {
        "state": "idle",
        "fps": 6,
        "loop": true,
        "frame_count": 4
      },
      "spritesheet": {
        "url": "/assets/frontend_runtime_mock/atlas_sheets/enemy_shadow_tide_runner__unit_sprite__idle__spritesheet.png",
        "local_path": "game_data/media/frontend_runtime_mock/atlas_sheets/enemy_shadow_tide_runner__unit_sprite__idle__spritesheet.png",
        "width": 3344,
        "height": 836,
        "sha256": "6d5855b4d67002660163865ea261d6c2cadf713fcba13fbd34c9267b731348f2"
      },
      "frames": [
        {
          "frame_id": "enemy_shadow_tide_runner.unit_sprite.idle.frame_000",
          "index": 0,
          "url": "/assets/frontend_runtime_mock/processed/enemy_shadow_tide_runner_unit_sprite_cdd10059.png",
          "local_path": "game_data/media/frontend_runtime_mock/processed/enemy_shadow_tide_runner_unit_sprite_cdd10059.png",
          "x": 0,
          "y": 0,
          "width": 836,
          "height": 836,
          "duration_ms": 167,
          "sha256": "79267e53a177494af1a824381cd6bc3ddc41bfe7f651cf1b41a637f2d1406b9d",
          "anchor": {
            "preset": "bottom_center",
            "x": 0.5,
            "y": 1.0
          }
        },
        {
          "frame_id": "enemy_shadow_tide_runner.unit_sprite.idle.frame_001",
          "index": 1,
          "url": "/assets/frontend_runtime_mock/atlas_frames/enemy_shadow_tide_runner__unit_sprite__frame_001.png",
          "local_path": "game_data/media/frontend_runtime_mock/atlas_frames/enemy_shadow_tide_runner__unit_sprite__frame_001.png",
          "x": 836,
          "y": 0,
          "width": 836,
          "height": 836,
          "duration_ms": 167,
          "sha256": "c233f6f062bfc88c02be5473df547daed78fe8afabcdc1a74f7ee295bd783321",
          "anchor": {
            "preset": "bottom_center",
            "x": 0.5,
            "y": 1.0
          }
        },
        {
          "frame_id": "enemy_shadow_tide_runner.unit_sprite.idle.frame_002",
          "index": 2,
          "url": "/assets/frontend_runtime_mock/atlas_frames/enemy_shadow_tide_runner__unit_sprite__frame_002.png",
          "local_path": "game_data/media/frontend_runtime_mock/atlas_frames/enemy_shadow_tide_runner__unit_sprite__frame_002.png",
          "x": 1672,
          "y": 0,
          "width": 836,
          "height": 836,
          "duration_ms": 167,
          "sha256": "6ae803ae0401c03fbfdd4081e157ae02201dfc081b797c34ecdfd2b5a6e9bbc2",
          "anchor": {
            "preset": "bottom_center",
            "x": 0.5,
            "y": 1.0
          }
        },
        {
          "frame_id": "enemy_shadow_tide_runner.unit_sprite.idle.frame_003",
          "index": 3,
          "url": "/assets/frontend_runtime_mock/atlas_frames/enemy_shadow_tide_runner__unit_sprite__frame_003.png",
          "local_path": "game_data/media/frontend_runtime_mock/atlas_frames/enemy_shadow_tide_runner__unit_sprite__frame_003.png",
          "x": 2508,
          "y": 0,
          "width": 836,
          "height": 836,
          "duration_ms": 167,
          "sha256": "9f5feddc7c763486065921ed0e4311820ebc0cf996179c65ad3d716f594b1202",
          "anchor": {
            "preset": "bottom_center",
            "x": 0.5,
            "y": 1.0
          }
        }
      ]
    },
    {
      "animation_id": "enemy_shadow_tide_shade.icon.static",
      "asset_id": "enemy_shadow_tide_shade",
      "source_game_id": "shadow_tide_shade",
      "asset_name": "影潮残影",
      "asset_type": "enemy_archetype",
      "media_role": "icon",
      "frame_source_kind": "single_frame_static",
      "loop_continuity_ref": null,
      "playback": {
        "state": "static",
        "fps": 1,
        "loop": false,
        "frame_count": 1
      },
      "spritesheet": {
        "url": "/assets/frontend_runtime_mock/atlas_sheets/enemy_shadow_tide_shade__icon__static__spritesheet.png",
        "local_path": "game_data/media/frontend_runtime_mock/atlas_sheets/enemy_shadow_tide_shade__icon__static__spritesheet.png",
        "width": 874,
        "height": 874,
        "sha256": "416b0b6d4729246d5db0bce45ed8c2258cadbeca548915373c6f84384a01b7c8"
      },
      "frames": [
        {
          "frame_id": "enemy_shadow_tide_shade.icon.static.frame_000",
          "index": 0,
          "url": "/assets/frontend_runtime_mock/processed/enemy_shadow_tide_shade_icon_374a7a0b.png",
          "local_path": "game_data/media/frontend_runtime_mock/processed/enemy_shadow_tide_shade_icon_374a7a0b.png",
          "x": 0,
          "y": 0,
          "width": 874,
          "height": 874,
          "duration_ms": 1000,
          "sha256": "416b0b6d4729246d5db0bce45ed8c2258cadbeca548915373c6f84384a01b7c8",
          "anchor": {
            "preset": "center",
            "x": 0.5,
            "y": 0.5
          }
        }
      ]
    },
    {
      "animation_id": "enemy_shadow_tide_shade.unit_sprite.idle",
      "asset_id": "enemy_shadow_tide_shade",
      "source_game_id": "shadow_tide_shade",
      "asset_name": "影潮残影",
      "asset_type": "enemy_archetype",
      "media_role": "unit_sprite",
      "frame_source_kind": "deterministic_frame_sequence",
      "loop_continuity_ref": "examples/review_packs/frontend_runtime_loop_continuity_report.v0.1.json#enemy_shadow_tide_shade.unit_sprite.idle",
      "playback": {
        "state": "idle",
        "fps": 6,
        "loop": true,
        "frame_count": 4
      },
      "spritesheet": {
        "url": "/assets/frontend_runtime_mock/atlas_sheets/enemy_shadow_tide_shade__unit_sprite__idle__spritesheet.png",
        "local_path": "game_data/media/frontend_runtime_mock/atlas_sheets/enemy_shadow_tide_shade__unit_sprite__idle__spritesheet.png",
        "width": 3556,
        "height": 889,
        "sha256": "309b272f333560e20ca5535825936eb1ec0b1bb7279289708de4afabc742a937"
      },
      "frames": [
        {
          "frame_id": "enemy_shadow_tide_shade.unit_sprite.idle.frame_000",
          "index": 0,
          "url": "/assets/frontend_runtime_mock/processed/enemy_shadow_tide_shade_unit_sprite_e994eb94.png",
          "local_path": "game_data/media/frontend_runtime_mock/processed/enemy_shadow_tide_shade_unit_sprite_e994eb94.png",
          "x": 0,
          "y": 0,
          "width": 889,
          "height": 889,
          "duration_ms": 167,
          "sha256": "a6b50eccaea431fb0554b393dfeb747af7c4ac1388f77b43dbba33e5589a689a",
          "anchor": {
            "preset": "bottom_center",
            "x": 0.5,
            "y": 1.0
          }
        },
        {
          "frame_id": "enemy_shadow_tide_shade.unit_sprite.idle.frame_001",
          "index": 1,
          "url": "/assets/frontend_runtime_mock/atlas_frames/enemy_shadow_tide_shade__unit_sprite__frame_001.png",
          "local_path": "game_data/media/frontend_runtime_mock/atlas_frames/enemy_shadow_tide_shade__unit_sprite__frame_001.png",
          "x": 889,
          "y": 0,
          "width": 889,
          "height": 889,
          "duration_ms": 167,
          "sha256": "6c6986a4bfc0d5fc915401285e61eba6346918890f7e673d28761916fa857bdc",
          "anchor": {
            "preset": "bottom_center",
            "x": 0.5,
            "y": 1.0
          }
        },
        {
          "frame_id": "enemy_shadow_tide_shade.unit_sprite.idle.frame_002",
          "index": 2,
          "url": "/assets/frontend_runtime_mock/atlas_frames/enemy_shadow_tide_shade__unit_sprite__frame_002.png",